Text,Address,Street_Number,Street_Name,Street_Address,City,Zip_Code,State,Country
"Visit us at 19 St Andrew St, Burlington, VT 05401, United States. For inquiries, call us at 802-123-4567.",19,ST ANDREW ST,19 ST ANDREW ST,BULRINGTON,05401,VT,United States,Text
"Reach out to us at 2574 East 23rd Street, Chattanooga, TN 37404, United States. Our customer service hotline is 423-789-1011.",2574,EAST 23RD STREE,2574 EAST 23RD STREE,CHATTANOOGA,37404,TN,United States,"Visit us at 19 St Andrew St, Burlington, VT 05401, United States. For inquiries, call us at 802-123-4567."
"Come see us at 5931 W Angela Rd, Memphis, TN 38120, United States. Contact us at 901-234-5678.",5931,W ANGELA RD,5931 W ANGELA RD,MEMPHIS,38120,TN,United States,"Reach out to us at 2574 East 23rd Street, Chattanooga, TN 37404, United States. Our customer service hotline is 423-789-1011."
"Find us at 3812 Myers Street, Greeneville, TN 37743, United States. For assistance, dial 423-345-6789.",3812,MYERS STREET,3812 MYERS STREET,GREENEVILLE,37743,TN,United States,"Come see us at 5931 W Angela Rd, Memphis, TN 38120, United States. Contact us at 901-234-5678."
"Stop by at HWY 33 By-Pass Box, Dyersburg, TN 38024, United States. Call us at 731-456-7890.",,,HWY 33 BY-PASS BOX,DYERSBURG,38024,TN,United States,"Find us at 3812 Myers Street, Greeneville, TN 37743, United States. For assistance, dial 423-345-6789."
"Visit our office at 423 Trent State Stre, Dover, DE 19001, United States. Get in touch at 302-123-4567.",423,TRENT STATE STRE,423 TRENT STATE STRE,DOVER,19001,DE,United States,"Stop by at HWY 33 By-Pass Box, Dyersburg, TN 38024, United States. Call us at 731-456-7890."
"Drop by at 269 Abbott Mt Road, Chattanooga, TN 37405, United States. Reach us at 423-567-8910.",269,ABBOTT MT ROAD,269 ABBOTT MT ROAD,CHATTANOOGA,37405,TN,United States,"Visit our office at 423 Trent State Stre, Dover, DE 19001, United States. Get in touch at 302-123-4567."
"Find us along Highway 11-E, Russellville, TN 00000, United States. For more information, call 423-678-9101.",,,HIGHWAY 11-E,RUSSELLVILLE,00000,TN,United States,"Drop by at 269 Abbott Mt Road, Chattanooga, TN 37405, United States. Reach us at 423-567-8910."
"Come visit us at 8725 Hwy 62 N, Millington, TN 38053, United States. Contact our office at 901-234-5670.",8725,HWY 62 N,8725 HWY 62 N,MILLINGTON,38053,TN,United States,"Find us along Highway 11-E, Russellville, TN 00000, United States. For more information, call 423-678-9101."
"Stop by our location at 6081 Summer Avenue, Memphis, TN 38134, United States. Get in touch at 901-345-6781.",6081,SUMMER AVENUE,6081 SUMMER AVENUE,MEMPHIS,38134,TN,United States,"Come visit us at 8725 Hwy 62 N, Millington, TN 38053, United States. Contact our office at 901-234-5670."
"Visit our office at STE 363 8 Regency Sq, Knoxville, TN 37915, United States. Feel free to reach out for any inquiries!",8,REGENCY SQ,8 REGENCY SQ,KNOXVILLE,37915,TN,United States,"Stop by our location at 6081 Summer Avenue, Memphis, TN 38134, United States. Get in touch at 901-345-6781."
"Stop by the Nat Trust Center at 1612 Redwood Street, Wilmington, DE 19801, United States. We're here to assist you!",1612,REDWOOD STREET,1612 REDWOOD STREET,WILMINGTON,19801,DE,United States,"Visit our office at STE 363 8 Regency Sq, Knoxville, TN 37915, United States. Feel free to reach out for any inquiries!"
"Mail us at PO Box 631, Giddings, TX 78942, United States. We look forward to hearing from you!",,,,GIDDINGS,78942,TX,United States,"Stop by the Nat Trust Center at 1612 Redwood Street, Wilmington, DE 19801, United States. We're here to assist you!"
"Come see us at 9281 S Main St, PO Box 284, Springfield, TN 37172, United States. Your satisfaction is our priority!",9281,S MAIN ST,9281 S MAIN ST,SPRINGFIELD,37172,TN,United States,"Mail us at PO Box 631, Giddings, TX 78942, United States. We look forward to hearing from you!"
"Send your correspondence to PO Box 3028 Omohun, Nashville, TN 37210, United States. We are eager to connect!",,,,NASHVILLE,37210,TN,United States,"Come see us at 9281 S Main St, PO Box 284, Springfield, TN 37172, United States. Your satisfaction is our priority!"
"Visit our St. Louis location at 375 McDonnell Blvd, PO Box 5840, St. Louis, MO 63134, United States. We await your visit!",375,MCDONNELL BLVD,375 MCDONNELL BLVD,ST. LOUIS,63134,MO,United States,"Send your correspondence to PO Box 3028 Omohun, Nashville, TN 37210, United States. We are eager to connect!"
"Reach out via mail at PO Box 724, Trussville, AL 35173, United States. We're always here for you!",,,,TRUSSVILLE,35173,AL,United States,"Visit our St. Louis location at 375 McDonnell Blvd, PO Box 5840, St. Louis, MO 63134, United States. We await your visit!"
"Write to us at PO Box 903, Baldwin, GA 30511-0484, United States. Let's get in touch!",,,,BALDWIN,30511-0484,GA,United States,"Reach out via mail at PO Box 724, Trussville, AL 35173, United States. We're always here for you!"
"Send your letters to PO Box 337, Nortonville, KS 66060-0452, United States. We're excited to hear from you!",,,,NORTONVILLE,660600452,KS,United States,"Write to us at PO Box 903, Baldwin, GA 30511-0484, United States. Let's get in touch!"
"Find us at Frank Rd, PO Box 24, So Pomfret, VT 05067, United States. We are here to serve you!",,FRANK RD,FRANK RD,SO POMFRET,05067,VT,United States,"Send your letters to PO Box 337, Nortonville, KS 66060-0452, United States. We're excited to hear from you!"
"Reach out to us at 221 Jim Sullivan Blvd, PO Box 1482, Salisbury, NC 28145-1127, United States. We're here to help!",221,JIM SULLIVAN BLVD,221 JIM SULLIVAN BLVD,SALISBURY,28145-1127,NC,United States,"Find us at Frank Rd, PO Box 24, So Pomfret, VT 05067, United States. We are here to serve you!"
"Send us your inquiries at PO Box 363, Hebronville, TX 78361, United States. We look forward to hearing from you!",,,HEBRONVILLE,78361,TX,United States,,"Reach out to us at 221 Jim Sullivan Blvd, PO Box 1482, Salisbury, NC 28145-1127, United States. We're here to help!"
"Visit us at 178 W Ridge Ave, PO Box 344, Celina, TN 38551, United States, or drop us a line!",178,W RIDGE AVE,178 W RIDGE AVE,CELINA,38551,TN,United States,"Send us your inquiries at PO Box 363, Hebronville, TX 78361, United States. We look forward to hearing from you!"
"Mail your correspondence to PO Box 8231, Moultrie, GA 31776-1601, United States. We're eager to connect!",,,MOULTRIE,31776-1601,GA,United States,,"Visit us at 178 W Ridge Ave, PO Box 344, Celina, TN 38551, United States, or drop us a line!"
"Get in touch with Melissa Cardiff at 730 Winston St, Chestnut Hill, MA, USA. Your questions are important to us!",730,WINSTON ST,730 WINSTON ST,CHESTNUT HILL,,MA,USA,"Mail your correspondence to PO Box 8231, Moultrie, GA 31776-1601, United States. We're eager to connect!"
"Contact Windsor-Hanson Company at 391 Park Avenue, New York, NY 10022, United States. We're happy to assist!",391,PARK AVENUE,391 PARK AVENUE,NEW YORK,10022,NY,United States,"Get in touch with Melissa Cardiff at 730 Winston St, Chestnut Hill, MA, USA. Your questions are important to us!"
"Reach Frank C. Gosling at 206 Irving Ct, Franklin, TN 37064-5072, United States. Let's connect!",206,IRVING CT,206 IRVING CT,FRANKLIN,37064-5072,TN,United States,"Contact Windsor-Hanson Company at 391 Park Avenue, New York, NY 10022, United States. We're happy to assist!"
"Address your letters to Robert S. Marino at 52 Grey St., Lynn, MA, USA. We value your communication!",52,GREY ST,52 GREY ST,LYNN,,MA,USA,"Reach Frank C. Gosling at 206 Irving Ct, Franklin, TN 37064-5072, United States. Let's connect!"
"Send your queries to Lawson Trust, Memphis, TN 00000, United States. We're here to answer any questions!",,,MEMPHIS,00000,TN,United States,,"Address your letters to Robert S. Marino at 52 Grey St., Lynn, MA, USA. We value your communication!"
"Contact Key & Peele at 83 Main St., Leominster, MA, USA. We look forward to your message!",83,MAIN ST,83 MAIN ST,LEOMINSTER,,MA,USA,"Send your queries to Lawson Trust, Memphis, TN 00000, United States. We're here to answer any questions!"
"Reach us at C/O MATTHEW F. HOMER 771 ELM ST., SO DARTMOUTH, MA, USA for any inquiries.",771,ELM ST.,771 ELM ST.,SO DARTMOUTH,,MA,USA,"Contact Key & Peele at 83 Main St., Leominster, MA, USA. We look forward to your message!"
"Get in touch with C/O VERNON DORMER 92 BUCKINGHAM ST., SPRINGFIELD, MA, USA for further assistance.",92,BUCKINGHAM ST.,92 BUCKINGHAM ST.,SPRINGFIELD,,MA,USA,"Reach us at C/O MATTHEW F. HOMER 771 ELM ST., SO DARTMOUTH, MA, USA for any inquiries."
"Contact C/O WILL. F. MARE 16 BAILER HILL RD., WALTHAM, MA, USA for more information.",16,BAILER HILL RD.,16 BAILER HILL RD.,WALTHAM,,MA,USA,"Get in touch with C/O VERNON DORMER 92 BUCKINGHAM ST., SPRINGFIELD, MA, USA for further assistance."
"Visit us at C/O RABO UNITED BK 172 NAWAKA ST, CHATTANOOGA, TN 37401, United States for your banking needs.",172,NAWAKA ST,172 NAWAKA ST,CHATTANOOGA,37401,TN,United States,"Contact C/O WILL. F. MARE 16 BAILER HILL RD., WALTHAM, MA, USA for more information."
"Reach out to C/O EVL CORP SYSTEM, KNOXVILLE, TN 37902, United States for corporate services.",,,,KNOXVILLE,37902,TN,United States,"Visit us at C/O RABO UNITED BK 172 NAWAKA ST, CHATTANOOGA, TN 37401, United States for your banking needs."
"Contact C/O E M RICHARD RTE, COLUMBIA, TN 00000, United States for more details.",,,,COLUMBIA,00000,TN,United States,"Reach out to C/O EVL CORP SYSTEM, KNOXVILLE, TN 37902, United States for corporate services."
"Visit C/O One Kimberley Centre 13 JENKS AVE., FRAMINGHAM, MA, USA for our services.",13,JENKS AVE.,13 JENKS AVE.,FRAMINGHAM,,MA,USA,"Contact C/O E M RICHARD RTE, COLUMBIA, TN 00000, United States for more details."
"Get in touch with C/O JAN S MONTGOMERY, LEXINGTON, TN 38351, United States for any questions.",,,,LEXINGTON,38351,TN,United States,"Visit C/O One Kimberley Centre 13 JENKS AVE., FRAMINGHAM, MA, USA for our services."
"Find us at The Turner Building, 7310 West Central Avenue, Toledo, OH 43617-1087, US for more information.",7310,West Central Avenue,7310 West Central Avenue,,,43617-1087,US,"Get in touch with C/O JAN S MONTGOMERY, LEXINGTON, TN 38351, United States for any questions."
"Contact Building 12, 3525 Marchmont Rd SW Ste 500, ATLANTA, GA 30305-1608, US for our services.",3525,Marchmont Rd SW Ste 500,3525 Marchmont Rd SW Ste 500,ATLANTA,30305-1608,GA,US,"Find us at The Turner Building, 7310 West Central Avenue, Toledo, OH 43617-1087, US for more information."
"Come visit us at Building 8, 702 North Varina, Suite 230, TX 78746, US. For inquiries, call 123-456-7890 or email info@varinabuilding8.com.",702,North Varina,702 North Varina,Austin,78746,TX,US,"Contact Building 12, 3525 Marchmont Rd SW Ste 500, ATLANTA, GA 30305-1608, US for our services."
"Stop by Building 631, 9 Browning Pkwy Fl 1, San Mateo, CA 94403-1906, US. Reach us at 650-123-4567 or support@browningparkway.com.",9,Browning Pkwy,9 Browning Pkwy,San Mateo,94403-1906,CA,US,"Come visit us at Building 8, 702 North Varina, Suite 230, TX 78746, US. For inquiries, call 123-456-7890 or email info@varinabuilding8.com."
"Find us at ROYAL MANOR FINANCIAL CENTER, 6 Tampico Way, Suite 125A, Orinda, CA 94563, US. Contact us at 925-123-4567 or finance@royalmanor.com.",6,Tampico Way,6 Tampico Way,Orinda,94563,CA,US,"Stop by Building 631, 9 Browning Pkwy Fl 1, San Mateo, CA 94403-1906, US. Reach us at 650-123-4567 or support@browningparkway.com."
"Explore the Asian Culture Center at 7318 N Yarmouth St, Wilmington, DE 19801-1120, US. Get in touch at 302-123-4567 or info@asianculturecenter.com.",7318,N Yarmouth St,7318 N Yarmouth St,Wilmington,19801-1120,DE,US,"Find us at ROYAL MANOR FINANCIAL CENTER, 6 Tampico Way, Suite 125A, Orinda, CA 94563, US. Contact us at 925-123-4567 or finance@royalmanor.com."
"Visit us at Suite 920, One World Center, 6399 Empress Drive, Bethesda, MD 20817, US. Call 301-123-4567 or email contact@oneworldcenter.com.",6399,Empress Drive,6399 Empress Drive,Bethesda,20817,MD,US,"Explore the Asian Culture Center at 7318 N Yarmouth St, Wilmington, DE 19801-1120, US. Get in touch at 302-123-4567 or info@asianculturecenter.com."
"Join us at Four Saints Recreation Center, 527 Mikes St, New York, NY 10285-0001, US. Contact us at 212-123-4567 or recreation@foursaints.com.",527,Mikes St,527 Mikes St,New York,10285-0001,NY,US,"Visit us at Suite 920, One World Center, 6399 Empress Drive, Bethesda, MD 20817, US. Call 301-123-4567 or email contact@oneworldcenter.com."
"Meet us at ONE WORLD CENTER, 26th Floor, C/O Juan Leons Private EQ, Inc., San Francisco, CA 94111, US. Call us at 415-123-4567 or email privateeq@leons.com.",,JUAN LEONS PRIVATE EQ, JUAN LEONS PRIVATE EQ, San Francisco,94111,CA,US,"Join us at Four Saints Recreation Center, 527 Mikes St, New York, NY 10285-0001, US. Contact us at 212-123-4567 or recreation@foursaints.com."
"DE HEALTH Center, Research Building, 1733 Acero Highway, Wilmington, DE 19805, US. For appointments, call 302-555-1234 or email research@dehealth.org.",1733,Acero Highway,1733 Acero Highway,Wilmington,19805,DE,US,"Meet us at ONE WORLD CENTER, 26th Floor, C/O Juan Leons Private EQ, Inc., San Francisco, CA 94111, US. Call us at 415-123-4567 or email privateeq@leons.com."
"Visit 371 Bergenfield Center, 413 Haynes Street, Houston, TX 77002, US. Contact us at 713-123-4567 or info@bergenfieldcenter.com.",413,HAYNES STREET,413 HAYNES STREET,Houston,77002,TX,US,"DE HEALTH Center, Research Building, 1733 Acero Highway, Wilmington, DE 19805, US. For appointments, call 302-555-1234 or email research@dehealth.org."
"Come to 5125 Plymouth Blvd Ste 315, Plymouth, MN 55447-1551, US. Reach us at 763-123-4567 or email info@plymouthcenter.com.",5125,Plymouth Blvd,5125 Plymouth Blvd, Plymouth,55447-1551,MN,US,"Visit 371 Bergenfield Center, 413 Haynes Street, Houston, TX 77002, US. Contact us at 713-123-4567 or info@bergenfieldcenter.com."
"Reach out to us at PO Box 726, 399 N Virginia Blvd, Reading, PA 19610-0829, US. We're here to help!",399,N Virginia Blvd,399 N Virginia Blvd,READING,19610-0829,PA,US,"Come to 5125 Plymouth Blvd Ste 315, Plymouth, MN 55447-1551, US. Reach us at 763-123-4567 or email info@plymouthcenter.com."
"Visit our office at Suite 87, 3312 Jefferson Blvd, Houston, TX 77024, US. Stop by anytime!",3312,JEFFERSON BLVD,3312 JEFFERSON BLVD,HOUSTON,77024,TX,US,"Reach out to us at PO Box 726, 399 N Virginia Blvd, Reading, PA 19610-0829, US. We're here to help!"
"Come by and see us at 3991 Prairie Moon Blvd, Suite 419, Twinsburg, OH 44087, US. We'd love to meet you!",3991,Prairie Moon Blvd,3991 Prairie Moon Blvd,TWINSBURG,44087,OH,US,"Visit our office at Suite 87, 3312 Jefferson Blvd, Houston, TX 77024, US. Stop by anytime!"
"Our second-floor office is located at 13164 Aston Blvd Fl 2, Dallas, TX 75254-6786, US. Drop in!",13164,Aston Blvd,13164 Aston Blvd,DALLAS,75254-6786,TX,US,"Come by and see us at 3991 Prairie Moon Blvd, Suite 419, Twinsburg, OH 44087, US. We'd love to meet you!"
"Stop by our Boulder office at 2818 Railroad Blvd Ste 211, Boulder, CO 80301-2627, US. We're open for you!",2818,Railroad Blvd,2818 Railroad Blvd,BOULDER,80301-2627,CO,US,"Our second-floor office is located at 13164 Aston Blvd Fl 2, Dallas, TX 75254-6786, US. Drop in!"
"Visit our Teaneck location at 901 Shane M Connor Blvd Ste 52, Teaneck, NJ 07666-6703, US. We're here to assist!",901,Shane M Connor Blvd,901 Shane M Connor Blvd,TEANECK,07666-6703,NJ,US,"Stop by our Boulder office at 2818 Railroad Blvd Ste 211, Boulder, CO 80301-2627, US. We're open for you!"
"Find our Sarasota office at 6428 E Sidney Blvd, Sarasota, FL 34243-2249, US. Come and see us!",6428,E Sidney Blvd,6428 E Sidney Blvd,SARASOTA,34243-2249,FL,US,"Visit our Teaneck location at 901 Shane M Connor Blvd Ste 52, Teaneck, NJ 07666-6703, US. We're here to assist!"
"Reach us at 524 W Arbor Blvd, Fort Lauderdale, FL 33394, US. We're ready to help!",524,W Arbor Blvd,524 W Arbor Blvd,FORT LAUDERDALE,33394,FL,US,"Find our Sarasota office at 6428 E Sidney Blvd, Sarasota, FL 34243-2249, US. Come and see us!"
"Stop by our office at 2315 Wendover Blvd Ste 1785, Irving, TX 75039-3743, US. We'd love to assist you!",2315,Wendover Blvd,2315 Wendover Blvd,IRVING,75039-3743,TX,US,"Reach us at 524 W Arbor Blvd, Fort Lauderdale, FL 33394, US. We're ready to help!"
"Visit us at 9028 Birchwood Street - 5210, Houston, TX 77002, US. We're here for you!",9028,Birchwood Street,9028 Birchwood Street,HOUSTON,77002,TX,US,"Stop by our office at 2315 Wendover Blvd Ste 1785, Irving, TX 75039-3743, US. We'd love to assist you!"
"Visit us at 3612 W. 26Th Street, Suite 100, LEAWOOD, KS, 66211, US. Our team is ready to assist you!",6252,Sunset St,6252 Sunset St,BEAUMONT,77707-3514,TX,US,"Visit us at 9028 Birchwood Street - 5210, Houston, TX 77002, US. We're here for you!"
"Stop by our office at 25 ROSE STREET, STAMFORD, CT, 6901, US for any inquiries.",21,West 5th St,21 West 5th St, ,10010, ,US,"Visit us at 3612 W. 26Th Street, Suite 100, LEAWOOD, KS, 66211, US. Our team is ready to assist you!"
"Come see us at 315 Spider Ridge Street, BOSTON, MA, 2109, US. We are here to help!",763,Clark St,763 Clark St,BRAINERD,56401-3585,MN,US,"Stop by our office at 25 ROSE STREET, STAMFORD, CT, 6901, US for any inquiries."
"Find us at 624 Brockton St, BASTROP, TX, 78602-3818, US. Contact us for more information.",146,Lakeview St,146 Lakeview St,BOSTON,02199-3600,MA,US,"Come see us at 315 Spider Ridge Street, BOSTON, MA, 2109, US. We are here to help!"
"Reach out at 572 Yellow Street, Suite 201, OYSTER BAY, NY, 11771, US. We're here to support you.",383,Walker St,383 Walker St,DENVER,80206-4549,CO,US,"Find us at 624 Brockton St, BASTROP, TX, 78602-3818, US. Contact us for more information."
"Drop by 961 Malolo Street, NW, HANCEVILLE, AL, 35077, US. We look forward to meeting you!",53 C,Nn Hwy S,53 C Nn Hwy S,DARIEN,06820-4505,CT,US,"Reach out at 572 Yellow Street, Suite 201, OYSTER BAY, NY, 11771, US. We're here to support you."
"Visit our location at 376 Lasso St, BRENTWOOD, CA, 94513, US. Our doors are open for you!",492,Northwestern Hwy.,492 Northwestern Hwy.,FARMINGTON HILLS,48334,MI,US,"Drop by 961 Malolo Street, NW, HANCEVILLE, AL, 35077, US. We look forward to meeting you!"
"Stop in at 311 N 34th St, SIOUX FALLS, SD, 57108-8148, US. We're happy to assist with your needs.",4553,N Capital of Texas Hwy,4553 N Capital of Texas Hwy,AUSTIN,78746-6544,TX,US,"Visit our location at 376 Lasso St, BRENTWOOD, CA, 94513, US. Our doors are open for you!"
"Come see us at 675 SE Juan Pedro St, PORTLAND, OR, 97212-3948, US. We're here to help you out!",14130,Devon Hwy,14130 Devon Hwy,SANTA FE SPRINGS,90670-4836,CA,US,"Stop in at 311 N 34th St, SIOUX FALLS, SD, 57108-8148, US. We're happy to assist with your needs."
"Find us at 423 NE 5th St, POMPANO BEACH, FL, 33062-6746, US. Your satisfaction is our priority.",506,S Murdock Hwy,506 S Murdock Hwy,DEERFIELD BEACH,33441-4161,FL,US,"Come see us at 675 SE Juan Pedro St, PORTLAND, OR, 97212-3948, US. We're here to help you out!"
"Visit us at 6252 Sunset St, Beaumont, TX 77707-3514, US. Our doors are always open for you!",1719,W Federal Hwy,1719 W Federal Hwy Ste 633,BOCA RATON,33432-2744,FL,US,"Find us at 423 NE 5th St, POMPANO BEACH, FL, 33062-6746, US. Your satisfaction is our priority."
"Stop by our office: 14th Floor, 21 West 5th St, 10010, US. We look forward to assisting you!",31102,N Capital of Texas Hwy,31102 N Capital of Texas Hwy Ste 3104,WEST LAKE HILLS,78746-6502,TX,US,"Visit us at 6252 Sunset St, Beaumont, TX 77707-3514, US. Our doors are always open for you!"
"Come see us at 763 Clark St, Brainerd, MN 56401-3585, US. Your satisfaction is our priority.",72,W Johnston Hwy,72 W Johnston Hwy,ST AUGUSTINE,32084,FL,US,"Stop by our office: 14th Floor, 21 West 5th St, 10010, US. We look forward to assisting you!"
"Drop in at 146 Lakeview St, Boston, MA 02199-3600, US. Experience our exceptional service.",3262,SW Tucker Way,3262 SW Tucker Way # C453,PORTLAND,97230-1108,OR,US,"Come see us at 763 Clark St, Brainerd, MN 56401-3585, US. Your satisfaction is our priority."
"Meet us at 383 Walker St, Denver, CO 80206-4549, US. We're here to help with all your needs.",7284,VOLLMER PARKWAY,"7284 VOLLMER PARKWAY, SUITE 64",FOOTHILL RANCH,92610,CA,US,"Drop in at 146 Lakeview St, Boston, MA 02199-3600, US. Experience our exceptional service."
"Connect with us at 53 C Nn Hwy S Fl 4, Darien, CT 06820-4505, US. Let's make things happen together.",913,Old Evadale Way,913 Old Evadale Way,BELMONT,94002,CA,US,"Meet us at 383 Walker St, Denver, CO 80206-4549, US. We're here to help with all your needs."
"Visit our office at 492 Northwestern Hwy., Ste. 488, Farmington Hills, MI 48334, US. We're eager to assist you.",6337,NEW FORREST WAY,6337 NEW FORREST WAY,FREDERICK,21703,MD,US,"Connect with us at 53 C Nn Hwy S Fl 4, Darien, CT 06820-4505, US. Let's make things happen together."
"Join us at 4553 N Capital of Texas Hwy Ste 926, Austin, TX 78746-6544, US. Let's achieve great things together.",7385,Hartman Way,7385 Hartman Way,VISTA,92081,CA,US,"Visit our office at 492 Northwestern Hwy., Ste. 488, Farmington Hills, MI 48334, US. We're eager to assist you."
"Come by 14130 Devon Hwy, Santa Fe Springs, CA 90670-4836, US. We're excited to meet you.",52275,Woodson Way,52275 Woodson Way,SUN VALLEY,91352,CA,US,"Join us at 4553 N Capital of Texas Hwy Ste 926, Austin, TX 78746-6544, US. Let's achieve great things together."
"Stop in at 506 S Murdock Hwy # 301, Deerfield Beach, FL 33441-4161, US. We can't wait to serve you!",388,BROADWAY,388 BROADWAY 1ST FL,NEW YORK,10038,NY,US,"Come by 14130 Devon Hwy, Santa Fe Springs, CA 90670-4836, US. We're excited to meet you."
"Visit our office at 1719 W Federal Hwy Ste 633, BOCA RATON, FL, 33432-2744, US. We're here to assist you!",668,W. Heaton Parkway,668 W. Heaton Parkway Unit #H148,OREM,84097,UT,US,"Stop in at 506 S Murdock Hwy # 301, Deerfield Beach, FL 33441-4161, US. We can't wait to serve you!"
"Come by and see us at 31102 N Capital of Texas Hwy Ste 3104, WEST LAKE HILLS, TX, 78746-6502, US. Your satisfaction is our priority!",21664,Saint Peters Road,21664 Saint Peters Road, Solon, 44139,OH,US,"Visit our office at 1719 W Federal Hwy Ste 633, BOCA RATON, FL, 33432-2744, US. We're here to assist you!"
"Meet us at #12, 72 W. Johnston Hwy, ST AUGUSTINE, FL, 32084, US. We look forward to serving you!",48817,Hallman Road,48817 Hallman Road, Chagrin Falls,44023,OH,US,"Come by and see us at 31102 N Capital of Texas Hwy Ste 3104, WEST LAKE HILLS, TX, 78746-6502, US. Your satisfaction is our priority!"
"Stop by our location at 3262 SW Tucker Way # C453, PORTLAND, OR, 97230-1108, US for excellent service.",18232,Somerville Road,18232 Somerville Road,CORAL SPRINGS,33076,FL,US,"Meet us at #12, 72 W. Johnston Hwy, ST AUGUSTINE, FL, 32084, US. We look forward to serving you!"
"Join us at 7284 VOLLMER PARKWAY, SUITE 64, FOOTHILL RANCH, CA, 92610, US. We'd love to see you!",2811,Brevard Road,2811 Brevard Road,DOWNERS GROVE,60515,IL,US,"Stop by our location at 3262 SW Tucker Way # C453, PORTLAND, OR, 97230-1108, US for excellent service."
"Visit us at 913 Old Evadale Way, BELMONT, CA, 94002, US. We're here to help!",4750,Lonnie Road,4750 Lonnie Road,HOUSTON,77057,TX,US,"Join us at 7284 VOLLMER PARKWAY, SUITE 64, FOOTHILL RANCH, CA, 92610, US. We'd love to see you!"
"Drop by at 6337 NEW FORREST WAY, FREDERICK, MD, 21703, US. We're eager to assist you!",2213,Carter Road,2213 Carter Road,SANTA CLARA,95051,CA,US,"Visit us at 913 Old Evadale Way, BELMONT, CA, 94002, US. We're here to help!"
"Pay us a visit at 7385 Hartman Way, VISTA, CA, 92081, US. Your needs are our top priority!",705,Coleman Road,705 Coleman Road,OAK BROOK,60523,IL,US,"Drop by at 6337 NEW FORREST WAY, FREDERICK, MD, 21703, US. We're eager to assist you!"
"Find us at 52275 Woodson Way, Ste. 624, SUN VALLEY, CA, 91352, US. We're ready to serve you!",434,GRANT ROAD WEST,434 GRANT ROAD WEST,LARGO,33773,FL,US,"Pay us a visit at 7385 Hartman Way, VISTA, CA, 92081, US. Your needs are our top priority!"
"Come see us at 388 BROADWAY 1ST FL, NEW YORK, NY, 10038, US. We’re here for all your needs!",2515,Hancock Point Ct,2515 Hancock Point Ct # J,WINTER PARK,32792-8214,FL,US,"Find us at 52275 Woodson Way, Ste. 624, SUN VALLEY, CA, 91352, US. We're ready to serve you!"
"Visit us at 668 W. Heaton Parkway Unit #H148, OREM, UT, 84097, US. For inquiries, call 801-555-1234 or email info@heatonparkway.com.",6662,Laurel View Ct,6662 Laurel View Ct,OXNARD,93036-5458,CA,US,"Come see us at 388 BROADWAY 1ST FL, NEW YORK, NY, 10038, US. We’re here for all your needs!"
"Come see us at 21664 Saint Peters Road, Suite, SOLON, OH, 44139, US. Reach out at 440-555-5678 or contact@stpeterssuite.com.",1092,Redfish Ct W,1092 Redfish Ct W,ROSWELL,30076-4853,GA,US,"Visit us at 668 W. Heaton Parkway Unit #H148, OREM, UT, 84097, US. For inquiries, call 801-555-1234 or email info@heatonparkway.com."
"Discover our services at 48817 Hallman Road, Geauga County, CHAGRIN FALLS, OH, 44023, US. Call us at 440-555-7890 or email support@hallmanroad.com.",5078,SW 23rd Ct,5078 SW 23rd Ct,OPA LOCKA,33054-2357,FL,US,"Come see us at 21664 Saint Peters Road, Suite, SOLON, OH, 44139, US. Reach out at 440-555-5678 or contact@stpeterssuite.com."
"Join us at 18232 Somerville Road, CORAL SPRINGS, FL, 33076, US. For more information, contact 954-555-2345 or info@somervilleroad.com.",63,Hillcrest Ct E,63 Hillcrest Ct E,ROSWELL,30076-4814,GA,US,"Discover our services at 48817 Hallman Road, Geauga County, CHAGRIN FALLS, OH, 44023, US. Call us at 440-555-7890 or email support@hallmanroad.com."
"Stop by at 2811 Brevard Road, DOWNERS GROVE, IL, 60515, US. Get in touch at 630-555-3456 or email hello@brevardroad.com.",969,Forestdale Dr,969 Forestdale Dr,SPRING,77379-7890,TX,US,"Join us at 18232 Somerville Road, CORAL SPRINGS, FL, 33076, US. For more information, contact 954-555-2345 or info@somervilleroad.com."
