Text,Address,Street_Number,Street_Name,Street_Address,City,Zip_Code,State,Country
"Visit our office at 4750 Lonnie Road, Suite 542, HOUSTON, TX, 77057, US. Call us at 713-555-4567 or reach out at contact@lonnieroad.com.",2068,W Fairground Dr,2068 W Fairground Dr,KANSAS CITY,64163-1202,MO,US,"Stop by at 2811 Brevard Road, DOWNERS GROVE, IL, 60515, US. Get in touch at 630-555-3456 or email hello@brevardroad.com."
"Find us at 2213 Carter Road, Suite 260, SANTA CLARA, CA, 95051, US. For assistance, call 408-555-5678 or email support@carterroad.com.",11401,Bent Oak Dr,11401 Bent Oak Dr,SAN DIEGO,92130-3342,CA,US,"Visit our office at 4750 Lonnie Road, Suite 542, HOUSTON, TX, 77057, US. Call us at 713-555-4567 or reach out at contact@lonnieroad.com."
"Come by at 705 Coleman Road, OAK BROOK, IL, 60523, US. Call us at 630-555-6789 or email info@colemanroad.com.",2068,Burns Dr,2068 Burns Dr,LAS VEGAS,89119-6727,NV,US,"Find us at 2213 Carter Road, Suite 260, SANTA CLARA, CA, 95051, US. For assistance, call 408-555-5678 or email support@carterroad.com."
"Visit our location at 434 GRANT ROAD WEST, SUITE 140, LARGO, FL, 33773, US. Reach us at 727-555-7890 or contact@grantroadwest.com.",3602,Fox Ridge Dr,3602 Fox Ridge Dr,The Woodlands,77380,TX,US,"Come by at 705 Coleman Road, OAK BROOK, IL, 60523, US. Call us at 630-555-6789 or email info@colemanroad.com."
"Stop in at 2515 Hancock Point Ct # J, WINTER PARK, FL, 32792-8214, US. For more details, call 407-555-8901 or email info@hancockpoint.com.",59,Nickel Dr,59 Nickel Dr,ORCHARD PARK,14127-4101,NY,US,"Visit our location at 434 GRANT ROAD WEST, SUITE 140, LARGO, FL, 33773, US. Reach us at 727-555-7890 or contact@grantroadwest.com."
"Visit us at 6662 Laurel View Ct Ste 142, Oxnard, CA 93036-5458, US for all your needs.",41443,Lewis Dr,41443 Lewis Dr,BAKERSFIELD,93311-8714,CA,US,"Stop in at 2515 Hancock Point Ct # J, WINTER PARK, FL, 32792-8214, US. For more details, call 407-555-8901 or email info@hancockpoint.com."
"Come by our office at 1092 Redfish Ct W Ste 447, Roswell, GA 30076-4853, US and say hello!",3128,New Mcneil Dr,3128 New Mcneil Dr,RESTON,20191-3436,VA,US,"Visit us at 6662 Laurel View Ct Ste 142, Oxnard, CA 93036-5458, US for all your needs."
"Stop in at 5078 SW 23rd Ct Ste 255, Opa Locka, FL 33054-2357, US to learn more.",2502,NW 53rd St,2502 NW 53rd St Bldg C Ste 347,BELLEVUE,98007-3737,WA,US,"Come by our office at 1092 Redfish Ct W Ste 447, Roswell, GA 30076-4853, US and say hello!"
"We are located at 63 Hillcrest Ct E Ste 625, Roswell, GA 30076-4814, US. Drop by anytime!",4223,4th Ave,Robert Koch Bldg 4223 4th Ave,DETROIT,48202-2798,MI,US,"Stop in at 5078 SW 23rd Ct Ste 255, Opa Locka, FL 33054-2357, US to learn more."
"Find us at 969 Forestdale Dr Ste 377, Spring, TX 77379-7890, US for exciting offers.",429,Larson Bldg,429 Larson Bldg,PORTLAND,,OR,US,"We are located at 63 Hillcrest Ct E Ste 625, Roswell, GA 30076-4814, US. Drop by anytime!"
"Visit our Kansas City office at 2068 W Fairground Dr Ste 500, Kansas City, MO 64163-1202, US.",4520,Mount Olive Highway,4520 Mount Olive Highway, Austin, 78759 ,Texas,US,"Find us at 969 Forestdale Dr Ste 377, Spring, TX 77379-7890, US for exciting offers."
"Explore our services at 11401 Bent Oak Dr Ste 100, San Diego, CA 92130-3342, US.",202,Sleepy Hollow Pkwy,202 Sleepy Hollow Pkwy Bldg 2101 Ste 201,ATHENS,30606-3347,GA,US,"Visit our Kansas City office at 2068 W Fairground Dr Ste 500, Kansas City, MO 64163-1202, US."
"Check out our Las Vegas location at 2068 Burns Dr Ste B, Las Vegas, NV 89119-6727, US.",6,Hamlin Ln,Berger Bldg 6 Hamlin Ln Dept RB08,MIDDLE ISLAND,11953-0102,NY,US,"Explore our services at 11401 Bent Oak Dr Ste 100, San Diego, CA 92130-3342, US."
"Meet us at 3602 Fox Ridge Dr. Suite 833, The Woodlands, TX 77380, US for an appointment.",5524,Elmore Ave,5524 Elmore Ave Bldg 266,PHILADELPHIA,19146-2701,PA,US,"Check out our Las Vegas location at 2068 Burns Dr Ste B, Las Vegas, NV 89119-6727, US."
"Reach us at 59 Nickel Dr, Orchard Park, NY 14127-4101, US for more information.",1172,Hudson Way Pl,1172 Hudson Way Pl Bldg 3 Ste 530,LAKE OSWEGO,97035-5545,OR,US,"Meet us at 3602 Fox Ridge Dr. Suite 833, The Woodlands, TX 77380, US for an appointment."
